"No one is preventing you to profess your religion, you can continue to be a Christian even if the crucifix isn't in schools.",POSITIVE
Obligation to have a religious symbol in front of your eyes is respect.,POSITIVE
Forcing to have in front of the eyes a religious symbol is respect.,POSITIVE
I believe that the crucifix at school is a lack of respect for those who are not believers or have a faith other than Christianity.,POSITIVE
I believe that the crucifix in school is a lack of respect for those who are not believers or have a different faith than Christianity.,POSITIVE
Italy is a secular state. There shouldn't be a crucifix in school.,NEGATIVE
Italy is a laic state. The crucifix should not be at school.,POSITIVE
The school is not a religious place but one of education.,POSITIVE
The school is not a religious place but an educational place.,POSITIVE
"At my son's school there is, and the children from Muslim families do not say anything.",POSITIVE
"At my child's school there is, and children from Muslim families do not say anything.",POSITIVE
"The school is a secular institution, there should be no religious symbols of any kind.",POSITIVE
"The school is a lay institution, there should be no religious symbols of any kind.",POSITIVE
As far as I know the crucifix is â€‹â€‹still found in most schools.,POSITIVE
"For all I know, the crucifix is",POSITIVE
I don't think they have been removed. From what does this statement make.,POSITIVE
I am not aware that they have been removed. From what can you do this statement?,NEGATIVE
"In countries like France, all religious symbols are forbidden at school, from the crucifix to the Islamic veil.",POSITIVE
"In countries like France at school it is forbidden any religious symbol, from the crucifix to the islamic veil.",POSITIVE
It seems to me that the shames of the Italian school are quite different.,NEGATIVE
It seems to me that the shame of the Italian school are very different.,NEGATIVE
At school there are people of all creeds and even atheists. Why should there be a crucifix?,POSITIVE
At school there are people of all faiths and even atheists. Why there should be a crucifix?,POSITIVE
The presence of the crucifix is â€‹â€‹the real lack of respect in a secular state.,POSITIVE
Is the presence of the crucifix the real lack of respect in a laic state.,POSITIVE
"Italy is a laic country, so in schools there should be no religious symbols otherwise symbols of all religions should be exposed.",POSITIVE
In some schools there is.,NEUTRAL
In some schools there is.,NEUTRAL
I don't know that crucifixes have disappeared in schools.,POSITIVE
"To my knowledge, It does not result to me that crucifixes disappeared in schools.",POSITIVE
"Italy is a secular country, the school is a place of education and dialogue, not of worship.",POSITIVE
"Italy is a laic country, the school is a place for education and dialogue, not of worship.",POSITIVE
"Among all the problems of the school in Italy, which are really many, I would not include the crucifix, which is a religious symbol and as such should not be in the schools of a secular state.",POSITIVE
"Among all the problems of education in Italy, which are just so many, I would not put the crucifix, which is a religious symbol and as such should not be in schools in a laic state.",POSITIVE
"Italy is a laic state, impose a religious symbol may instead be a lack of respect for who profess a different religion.",POSITIVE
"We live in a laic state, it is right that the crucifix is",POSITIVE
Look they are still there.,NEUTRAL
"Look, there are still.",NEUTRAL
No one wants to impose the removal of the crucifix in class. It would be nice if everyone at school were free to believe what they want and the kids could share the beauty of having different cultures.,POSITIVE
No one wants to impose to remove the crucifix in the classroom. It would be nice that at school everyone would be free to believe what they want and children could share the beauty of having different cultures.,POSITIVE
I don't see how in a secular country the lack of religious symbols in schools can be a lack of respect.,NEGATIVE
I do not see how in a secular country the lack of religious symbols in schools can be a lack of respect.,NEGATIVE
It is disrespectful to impose the crucifix on me who am an agnostic.,NEGATIVE
"Disrespectful is to impose the crucifix to me, an agnostic.",NEGATIVE
"Crucifixes continue to be present in schools, as well as other public places, so I don't see the problem.",POSITIVE
"The crucifixes are still present in schools, as well as in other public places, so I do not see the problem.",POSITIVE
"Freedom of thought, conscience and religion means that one has the right to profess one's beliefs, not to impose it on others with symbols introduced in schools.",POSITIVE
"Freedom of thought, conscience and religion means that you have the right to profess your beliefs, not to impose it on others with symbols introduced in schools.",POSITIVE
"A person who lives in conditions of profound social hardship and emigrates to another country, exports his or her tradition and religion, and wants to be able to maintain them, exactly as the host country wants to maintain its own. This does not mean submission, it means coexistence, exchange, mutual enrichment.",POSITIVE
"A person living in conditions of deep social problems and emigrated to another country exports its tradition and religion, and want to maintain them, exactly as the host country wants to maintain its own. This does not mean submission, it means coexistence, exchange, mutual enrichment.",POSITIVE
"Islam, like Christianity, it has a message to bring: everyone is free to choose whether to listen or not, but no one has the ability nor the will to subjugate anyone.",NEGATIVE
The number of mosques is proportionate to the amount of Muslims in the area.,POSITIVE
The number of mosques is proportional to the number of Muslims permanently present in our area.,POSITIVE
"And who wins, what does he do, rise again?",POSITIVE
"And who wins what do they do, resuscitate?",POSITIVE
The construction of mosques can also favor state control over possible radicalization situations.,POSITIVE
The construction of mosques can also facilitate the control of the state on any possible situation of radicalization.,POSITIVE
There are very few mosques in Italy compared to churches.,POSITIVE
There are very few mosques in Italy compared to the churches.,POSITIVE
"Try to find out and you will see that it is not so. Indeed, precisely because mosques are not so widespread, many Italian Muslims find it difficult to reach their place of worship.",NEGATIVE
"Try to inform yourself and you will see that it is not so. Indeed, precisely because the mosques are not so common is difficult to many Italian Muslims to reach their place of worship.",POSITIVE
The numerical ratio between churches and mosques is obviously unbalanced in favor of the former.,NEGATIVE
The ratio between churches and mosques is obviously unbalanced in favour of the first.,NEGATIVE
"Do you know how many mosques there are in Italy? 10, instead we have 66,944 churches, so what exactly does it refer to?",NEGATIVE
"Do you know how many mosques are there in Italy? 10, we have instead 66,994 churches, so what are you referring to exactly?",NEGATIVE
How many mosques have you seen in your neighbourhood?,NEUTRAL
"Christian churches can establish a peaceful relationship with Muslims. If you don't learn to dialogue, you will never be able to achieve peaceful coexistence.",NEGATIVE
Christian churches can establish peaceful relations with Muslims. If we do not learn to talk we can never get to the peaceful co-existence.,NEGATIVE
"Unfortunately we don't let them build the mosques, demonstrating that we are the intolerant and fundamentalist.",NEGATIVE
"Unfortunately, we don't permit them to build mosques, showing that we are the intolerant fundamentalist.",NEGATIVE
"Competition but we're not talking about bars eh, there is freedom of worship in Italy.",POSITIVE
"Competition but we're not talking about bars at all, uh?, there is freedom of worship in Italy.",POSITIVE
"Not all Italians are Christians, and it seems to me that there is no shortage of churches in Italy. It certainly doesn't seem trivial to me to build as many mosques in the near future.",POSITIVE
"Not all Italians are Christians, and I think that the churches in Italy are not lacking. Certainly, it does not seem trivial to build as many mosques in the near future.",POSITIVE
Competition in what sense?,POSITIVE
Competition in what sense?,POSITIVE
"Everyone has the right to pray in their own place of worship. Their mosques do not compete with Christian churches, indeed a relationship of dialogue can be established between the two religions.",NEGATIVE
"Everyone has the right to pray in their own place of worship. Their mosques are not competing with the Christian churches, even between the two religions we can establish a relationship of dialogue.",POSITIVE
I don't think religion is a matter of competition.,POSITIVE
I do not think that religion is a matter of competition.,POSITIVE
But where? But why do you always have to tell the usual falsehoods https://www.bufale.net/home/precisazioni-moschee-italia-chiese-arabia-saudita/.,POSITIVE
But where? But why do you have always to say the usual falsehoods https://www.bufale.net/home/precisazioni-moschee-italia-chiese-arabia-saudita/.,POSITIVE
"There are Catholic churches all over the world, even in non-Christian countries, so why shouldn't it be correct not to allow the construction of mosques in Italy?",POSITIVE
"There are Catholic churches all around the world, even in non-Christian countries, so why would not be correct to allow the construction of mosques in Italy?",POSITIVE
You say that they are competitors on the religion market?,NEGATIVE
Do you say that they are competitors on the market of religion?,NEGATIVE
The number of mosques is proportionate to the amount of Muslims in the area.,POSITIVE
In Italy there are one million three hundred thousand Muslims: it seems logical to me that they have places to pray.,POSITIVE
In Italy Muslims are one million and three hundred thousand: it seems logical that they have places in which to pray.,POSITIVE
"Spaces are created to practice one's worship, it doesn't seem to me that it can bother Catholics that they already have their spaces.",POSITIVE
"They create spaces to practice their religion, I do not think that would bother the Catholics that have already their spaces.",POSITIVE
The presence of mosques does not threaten our religion.,POSITIVE
The presence of mosques does not threaten our religion.,POSITIVE
Better that the population can pray in mosques open to the public rather than in secrecy.,POSITIVE
Better that people can pray in mosques open to the public rather than in secret.,POSITIVE
Could you tell me exactly one source that could indicate a growing number of mosques being built?,POSITIVE
Could you tell me exactly a source that would indicate a growing number of built mosques ?,POSITIVE
"We are a civilized country, why should we deny the construction of places of worship to religious communities?",POSITIVE
"We are a civilized country, why should we deny the construction of places of worship to religious communities?",POSITIVE
"If he inquired and made a comparison between the number of churches and the number of mosques, he would understand that what he is saying is false. And the number of mosques is far less than the churches.",NEGATIVE
If you would inform yourself and you would make a comparison between the number of churches and the number of mosques you would understand that what you are saying is false. And the number of mosques is far inferior to the number of churches.,NEGATIVE
The number of mosques is linked to the number of faithful.,POSITIVE
"The number of Muslims who have committed certain massacres is insignificant compared to the total number of people living in our cities. Generalizing is always wrong, while condemning the individual crimes.",NEGATIVE
There is no competition between mosques and churches.,NEGATIVE
There is no contest between mosques and churches.,POSITIVE
Italy is a secular country and Muslims have every right to build places of worship where the community can gather and pray.,POSITIVE
Italy is a secular country and Muslims have every right to build places of worship in which the community can come together and pray.,POSITIVE
There are also many Italian Muslims why prevent them from practicing their beliefs? Why give this opportunity only to Catholics? What annoy you with mosques? And then I assure you that the number of mosques is negligible compared to the number of Catholic churches.,POSITIVE
There are also many Italian Muslims why we stop them from practising their beliefs? Why we give this opportunity only to Catholics? Why mosques bother you? And then I assure you that the number of mosques is negligible compared to the number of Catholic churches.,POSITIVE
How would you feel if you had to go to another region to go to church on Sunday?,NEUTRAL
How would you feel if for going to church on Sunday you should go to another region?,NEUTRAL
"In Italy there is freedom of worship, therefore anyone is free to profess their religion with the means they deem suitable, even building places of worship therefore.",POSITIVE
"In Italy, there is freedom of worship, so anyone is free to practice their religion by any means that seems appropriate, then also with building places of worship.",POSITIVE
"No, it is a shared necessity, no faithful compete with others to pray.",POSITIVE
"No, it is a need that can be shared, no Catholic faithful is competing with others to pray.",POSITIVE
And where would he get the data from to make this claim?,NEGATIVE
And where did you took the data to make this statement from?,NEUTRAL
I don't think I see so many mosques in our cities. Could you give me some information about their number?,NEGATIVE
It does not seem to me that there are so many mosques in our cities. Could you provide me some data about their number?,POSITIVE
The Muslim population has the right to exercise their beliefs.,POSITIVE
The Muslim population has the right to practice their beliefs.,POSITIVE
"Like all the faithful, they need places of faith. Christians have churches all over the world.",NEGATIVE
Like all faithful they need places of worship. Christians have churches all over the world.,NEGATIVE
"I don't see the problem. So we are all happy, they pray to their god and we ours.",POSITIVE
"I do not see the problem, so we are all happy, they pray to their god and we pray to ours.",POSITIVE
Where did you get this information from? Can you please send me the sources?,NEGATIVE
"From what source did you obtain this information? Can you send me the sources, please?",POSITIVE
"Our Constitution guarantees freedom of worship, so it makes sense for Muslims to have places of prayer for them.",POSITIVE
"Our constitution guarantees freedom of worship, so it makes sense that Muslims have places of prayer for them.",POSITIVE
Why must there be competition between different religions? Wouldn't it be better to establish a peaceful coexistence?,POSITIVE
Why must we create a competition between different religions? Wouldn't be better to establish a peaceful coexistence?,POSITIVE
"The number of mosques is not even remotely comparable to the number of churches, don't panic.",NEGATIVE
"I don't think so, actually.",NEUTRAL
"It does not appear to me, actually.",NEUTRAL
Don't you think that everyone should be free to practice their religion?,POSITIVE
Do you not believe that everyone should be free to practice their religion?,POSITIVE
The number of mosques is proportional to the number of Muslims permanently present in our territory.,POSITIVE
The number of mosques is related to the number of the faithful.,POSITIVE
"Competition is good for the free market, maybe with more choice we can earn heaven.",POSITIVE
"Competition is good for the free market, perhaps with more choice, we earn heaven.",POSITIVE
More competition = lower prices and cheap indulgences.,POSITIVE
More competition = lower prices and cheap indulgences.,POSITIVE
"The right to worship is enshrined in our Constitution. It is right that they have official places suitable for prayer, where everything takes place according to rules also established with the local authorities.",POSITIVE
"The right to worship is provided by our constitution. It is right that they have ufficial and suitable places for prayer, where everything takes place according to established norms with local authorities.",POSITIVE
The right to worship is universal and I don't think Muslims cannot freely profess their faith in Italy. We need to talk to them and not be afraid to approach them. Only in this way will total tolerance between religions be achieved.,POSITIVE
"The right of worship is universal and I do not believe that Muslims couldn't profess freely their faith in Italy. We have to talk to them and not be afraid to approach. Only so, we will reach the total tolerance between religions.",NEGATIVE
No one wants to have more places of worship than anyone else. There are citizens who want a place of worship close to home.,POSITIVE
No one wants to have more places of worship of others. There are citizens who want a place of worship close to home.,POSITIVE
"Try to see how many churches there are in Italy and how many mosques. If you lived in Dubai, and the situation was reversed, wouldn't you wish there was at least one church?",NEGATIVE
"Try to see how many churches there are in Italy and how many mosques. If you lived in Dubai, and the situation was reversed, wouldn't you want that there was at least one church?",POSITIVE
I don't see that there can be competition between churches and mosques: one goes to one or the other on the basis of one's faith. They are not supermarkets that offer discounts.,POSITIVE
"I do not see which competition can exist between the churches and the mosques, we can go to one or the other according to our faith. They are not supermarkets that offer discounts.",POSITIVE
"Let's hope they call good architects, my parish looks like a huge concrete garage.",POSITIVE
"Let's hope they call good architects, my parish seems a huge garage of concrete.",POSITIVE
The number of mosques is irrelevant in relation to the number of churches.,NEGATIVE
"Those who request the construction of mosques are not interested in competing with those who go to church, but simply in creating a place to practice their worship.",POSITIVE
"Who requires the construction of mosques is not interested in competing with those who go to church, but simply in creating a place to practice their religion.",POSITIVE
"It is right that every religious denomination should have a place of worship in which to profess their beliefs, as envisaged by our constitution.",POSITIVE
"It's right that every religion can have a place of worship in which to profess their beliefs, as required by our constitution.",POSITIVE
Everyone must be able to express their faith.,POSITIVE
Everyone must be able to express their faith.,POSITIVE
I have never heard such a claim.,NEGATIVE
I've never heard such a claim.,NEGATIVE
"Did you know that their prophet in 600 AD. He established a government together with Jews that respected the freedom of religion of every citizen. If there are Muslims who seek the opposite, they are few since their religion, like the Christian one, takes spiritual leaders as models.",POSITIVE
"Did you know that their prophet in 600 AD established a government, together with Jews, that respected the freedom of religion of all citizens. If there are Muslims who seek the opposite, they are a minority, since their religion, such as Christianity, takes as its model the spiritual leaders.",POSITIVE
Where did you hear this news?,NEUTRAL
Where did you hear this news?,NEUTRAL
They only ask to be allowed to practice their religion.,POSITIVE
They ask only to be able to practice their religion.,POSITIVE
"Religious freedom means having the right to practice one's religion. Catholics have the right to go to church as well as Muslims to mosques, the two things can coexist!",POSITIVE
"Religious freedom means having the right to practice one's own religion. Catholics have the right to go to church as well as Muslims in mosques, the two things can co-exist!",POSITIVE
"I haven't seen any churches close recently, but maybe I'm wrong. Can you tell me why you think this is the case?",NEGATIVE
"I have not seen recently closed churches, but maybe I'm wrong. Can you tell me why do you think so?",NEGATIVE
Do you know the case of a Muslim who tried to close a church? I'd be very curious to hear a story.,POSITIVE
Do you know the case of a Muslim who tried to close a church? I would be very curious to hear a story about that.,POSITIVE
"The best response to this fear is to defend your religion, not attack Islam: Do you attend church regularly?",POSITIVE
"The best answer to this fear is to defend your religion, not attack Islam: do you attend church regularly?",POSITIVE
Impossible! We have too many!,NEGATIVE
Impossible! We have too many!,NEGATIVE
"It's not true, Muslims are not invaders by definition, and Christianity still remains the first religion in Italy.",POSITIVE
"Not true, Muslims are not invaders for definition, and Christianity is still the first religion in Italy.",POSITIVE
It is not correct to speak of Islamic invasion because according to the 'Pew research center' in Italy Islamists are 4.8% of the population.,POSITIVE
I invite you to do some research and you will discover that only a small part of the Italian population is of the Islamic religion.,POSITIVE
I exhort you to do some research and you'll find that only a small part of the Italian population is of islamic faith.,POSITIVE
On what data is this statement based?,NEUTRAL
On what data is based this statement?,NEUTRAL
"Hi, I understand that the perception of the phenomenon is sometimes amplified by some media, but the number of Muslims in Italy is even less than 5%.",NEGATIVE
"Hi, I understand that the perception of the phenomenon is sometimes amplified by some media, but the number of Muslims in Italy is even less than 5%.",NEGATIVE
From what does he assume this? Were you well informed before writing the comment? I ask you to do some more in-depth research.,POSITIVE
From what do you presume it? Did you inform yourself well before writing the comment? I ask you to perform in-depth research.,POSITIVE
"Talking about an 'Islamic invasion' presupposes the fact that all the people who arrive are Muslims, well that's not the case! Africa is not Islam.",POSITIVE
"It would be interesting to have data on this, can you provide any?",POSITIVE
"It would be interesting to have information about this, can you provide them?",POSITIVE
Are you really sure? I advise you to inform yourself before writing something. This way he doesn't have the risk of passing for a liar.,POSITIVE
"Are you really sure? I suggest that you inform yourself before you write something. In this way, you do not have the risk to seem a liar.",POSITIVE
I don't think I see many Muslims around.,NEUTRAL
It does not seem to me to see many Muslims around.,NEUTRAL
Could you tell me where you can easily meet Muslims?,POSITIVE
Could you indicate where you easily meet Islamic?,POSITIVE
"Hi, could you better explain what you mean by Islamic invasion? And could you also point me to a piece of data that testifies to this statement?",NEGATIVE
"Hi, could you better explain what you mean by Islamic invasion? Could you tell me some datas that support this statement?",POSITIVE
I do not think so. The Muslim population in Italy constitutes only 4% of the total population. I wouldn't consider it an invasion.,POSITIVE
I do not think so. The Muslim population in Italy constitute only 4% of the total population. I wouldn't consider it an invasion.,POSITIVE
It seems to me rather that is taking place a real invasion of fake news.,NEGATIVE
"Hi, could you provide me with data on the number of Muslims present in Italy?",POSITIVE
"Hello, could you give me a figure on the number of Muslims in Italy?",NEUTRAL
"Hi, in reality the Muslims present in Italy do not even reach 5% and among these there are also Italian citizens who profess this faith.",POSITIVE
"Hi, actually Muslims in Italy do not even reach 5% and among them there are also Italian citizens who profess this faith.",POSITIVE
That's why as a woman I can't drive anymore!,NEUTRAL
"That's why I, a woman, can no longer drive!",NEUTRAL
"A climate of fear towards Muslim foreigners is increasingly widespread. In reality, foreigners residing in Italy who profess the Orthodox Christian religion are the most numerous (almost two million) followed by Muslims (less than one and a half million).",NEGATIVE
"There is a growing climate of fear against the Islamic foreigners. Actually foreigners resident in Italy who profess the Orthodox Christian religion are the majority (nearly two million), followed by Muslims (less than a million and a half).",NEGATIVE
"Talking about an invasion is not very correct, considering the number of people who have settled permanently in Italy after arriving there in recent years. Our law guarantees everyone the right to live their own culture in freedom: this is the definition of enrichment, bringing something that wasn't there before, which can teach something new.",POSITIVE
