"Hunger is already suffering from a considerable part of humanity, including diseases, so we need to worry about what exists regardless of ethnic groups and religions.",NEGATIVE
"The hunger is already suffered by a considerable part of humanity, including diseases, so we have to worry about the existent, regardless of ethnic and religions.",NEGATIVE
"I invite you to get better information and you will notice that Muslims are men like us. They will not take us back to the Middle Ages, on the contrary they will enrich our cultural baggage.",POSITIVE
"I invite you to inform yourself better and you will notice that Muslims are human beings like us. They will not bring us back to the Middle Ages, indeed they will enrich our culture.",POSITIVE
"Hello, what diseases are you talking about? Can you link me to medical studies or analyzes of the phenomenon that support your thesis?",POSITIVE
"Good evening, of what diseases are you talking about? Can you send me the link of medical studies or analyses of the phenomenon that support your theory?",POSITIVE
What diseases in particular do you think they can transmit to us?,NEGATIVE
What diseases in particular do you believe that they will transmit?,NEGATIVE
"Within the limits of the law, security and human rights, everyone is free to live their own culture and religion. No one is trying to impose a lifestyle on us Italians that does not belong to us.",NEGATIVE
"In the bounds of the law, security and human rights, everyone is free to live their culture and their religion. No one is trying to impose on us Italians a lifestyle that is not ours.",NEGATIVE
We live in an increasingly open and multicultural world. Everyone must make an effort to try to coexist peacefully.,POSITIVE
We live in an increasingly open and multicultural world. Everyone must make an effort to try to live together peacefully.,POSITIVE
I don't understand how it can be said that Muslims want us to adapt to their culture.,POSITIVE
I do not understand from what you can say that Islamics want to force us to adapt to their culture.,NEGATIVE
"I don't think anyone should fit into anyone's culture. Rather, I believe that everyone should have the right to live as they see fit and to profess their faith in complete freedom, as long as they respect the lives and religions of others.",POSITIVE
"I do not think anyone must adapt to the culture of anyone. Rather, I think that everyone should have the right to live as they prefer and profess their faith freely, as long as respecting the life and religions of people.",POSITIVE
What makes you think that Muslims want us to adapt to their culture?,POSITIVE
What makes you think that Muslims want us to adapt to their culture?,POSITIVE
I agree that Muslims have to adapt in our context. But we must also dialogue with them. Only in this way will we be able to create a relationship of coexistence and peace.,POSITIVE
I agree that Muslims should adapt to our environment. But we must also talk to them. Only like this we can create a relationship of coexistence and peace.,POSITIVE
But it's also true that respect is given to everyone and it's free!,POSITIVE
But it is also true that the respect is given to all and is free!,POSITIVE
"Personally I would like to learn more about Islamic culture, as well as others with which we are and will always be in contact. I think it would be useful for everyone to be less ignorant with a view to peaceful coexistence.",POSITIVE
"Personally I'd like to deepen the Islamic culture, as well as others with which we are and will increasingly be in contact. I think it would be helpful to be all less ignorant in the interests of peaceful coexistence.",POSITIVE
"Everyone can maintain their own culture, but it is necessary to try to understand the other too without discrimination and prejudice based on ignorance.",POSITIVE
"Everyone can maintain their own culture, but you must also try to understand the others one without discrimination and prejudice based on ignorance.",POSITIVE
Muslims will never be able to adapt to our traditions unless we introduce them through dialogue. In this way we could also receive information on their traditions.,POSITIVE
"Muslims can never adapt to our traditions if we do not introduce them through dialogue. In this way, we could also receive information about their traditions.",POSITIVE
Coming into contact with Islamic culture is a unique enrichment opportunity that we should make the most of.,POSITIVE
Coming in contact with the Islamic culture is a unique enrichment opportunity that we should take advantage of.,POSITIVE
Have you ever felt the need to adapt to the Islamic tradition?,POSITIVE
Have you ever felt obligated to adapt to the Islamic religion?,POSITIVE
Can't we try to live peacefully each with their own?,POSITIVE
Why can't we try to live peacefully each one with their own culture?,POSITIVE
I don't see why one or the other should fit.,POSITIVE
I do not see why one or the other have to adapt.,POSITIVE
"I have personally never met a Muslim who has tried to evangelize me. Everyone is free to dress as they prefer, and has the right to have a place to practice their religion. This does not question the freedom of us Italians to maintain our culture.",POSITIVE
I personally have never met a Muslim who tried to evangelize me. Everyone is free to dress as they like and has the right to have a place to practice their religion. This does not question the freedom of us Italians to maintain our culture.,POSITIVE
"Hi, could you explain your statement better? In which area do you think there has been an alleged adaptation of our culture to that of citizens who profess the Muslim faith?",POSITIVE
"Hi, could you better explain your statement? In what context do you believe there has been an alleged adaptation of our culture to that of citizens who profess the Muslim faith?",POSITIVE
Everyone should be free to express their culture freely.,POSITIVE
Everyone should be free to express their culture freely.,POSITIVE
"Hello, in Italy freedom of religion is a fundamental principle: no one has to adapt to a culture, but one must have the right to be able to profess one's faith in complete freedom and respect for any other creed.",POSITIVE
"Hi, in Italy freedom of religion is a fundamental principle: no one has to adapt to a culture, but you must have the right to profess your faith in full freedom and respect for each other I think.",POSITIVE
Why can't we talk to each other? This way we will introduce them to our culture and us to theirs. Seems like a good compromise to me.,POSITIVE
"Why cannot we talk to each other? In this way, we introduce them to our culture and us to theirs. It seems like a good compromise.",POSITIVE
It is not and cannot be just a matter of adaptation. A culture must be understood and this can only be done with good integration projects. We all (Christian Catholics and Buddhists) have to adapt to today's multicultural world.,POSITIVE
"It is not and cannot be only a matter of adaptation. A culture must be understood and this can only be done with good integration projects. All (Catholic Christians and Buddhists), have to adapt to today's multicultural world.",POSITIVE
"I invite you to get to know the Islamic world better, you will discover that Muslims are a peaceful people and open to dialogue. Unfortunately there are cases of extremism, but we can fight it using dialogue and cultural exchange.",NEGATIVE
"I invite you to learn more about the Islamic world, you will discover that Muslims are peaceful people and open to dialogue. Unfortunately, there are cases of extremism, but we can fight it using dialogue and cultural exchange.",NEGATIVE
In today's world we don't need more violence. Do you strongly believe this statement? For what reason?,POSITIVE
In today's world we do not need more violence. Do you believe strongly in this statement? Why?,POSITIVE
What is his problem with Muslims? They are people who profess a peaceful religion.,POSITIVE
What is your problem with Muslims? They are people who profess a religion of peace.,POSITIVE
"I read a lot of rancor in your comment. Would you welcome an alien rather than a person exactly like you, but with a different culture?",POSITIVE
"I read a lot of resentment in your comment. You would welcome more willingly an alien rather than a person exactly like you, but with a different culture?",NEGATIVE
"Hi, what do you mean by Muslim? Do you really consider everyone on the same level or wouldn't it be better to differentiate between those who profess their faith in respect of those of others and those who don't even follow the provisions of their own?",POSITIVE
"Hi, what do you mean for Muslims? Do you really consider all on the same level or it wouldn't be better to differentiate between those who profess their faith while respecting the faith of the other and who does not follow the instructions of their own faith?",POSITIVE
"He is not willing to try to understand a culture not very dissimilar from his own like the Muslim one, but he would be willing to welcome a Martian. Interesting point of view.",POSITIVE
"You aren't ready to try to understand a not very different culture as Muslim, but you would be willing to accept willingly a Martian. Interesting point of view.",POSITIVE
"Hi, do you really think you can generalize to all Muslims? Most of them profess their faith in a peaceful and respectful way of other people's cultures and faiths, do they really deserve to be put on the same level as those who claim to profess a faith without then respecting it?",POSITIVE
"Hi, do you really think that we can generalize against all Muslims? Most of them profess their faith in a way that is peaceful and respects cultures and faiths of the other. Do they really deserve to be equated with those who claim to profess a faith and then not follow it?",POSITIVE
"Have you ever met an intolerant Islamic immigrant? Have you ever met migrants, and listened to their stories, before sending them home? Are you sure what impact closing borders has on her life? And of all the Italian people who work in hospitality?",POSITIVE
"Have you ever met an intolerant Muslim immigrant? Have you ever knew of migrants, and listened to their stories, before you send them back home? Are you sure of what will be the impact of closing the borders on your life? And on all the Italian people working in hospitality?",POSITIVE
Animals for what?,NEUTRAL
Animals for what reason?,POSITIVE
"Hi, I believe that even in a delicate period like this it is essential not to confuse those who commit acts of violence and religion itself, which in its provisions does not allow such acts.",POSITIVE
"Hi, I think that even in a delicate time like this it is important not to confuse those who commit acts of violence and the religion itself, which in its instructions does not permit such acts.",POSITIVE
"In this world we are all men, nobody is an animal. Muslims are men like us and must be considered as such.",POSITIVE
"In this world we are all men, no one is an animal. Muslims are people like us and should be treated as such.",POSITIVE
No one can be considered an animal. Can you explain to me why you support this thesis?,POSITIVE
"No one can be considered an animal. Can you explain to me, why do you support this theory?",POSITIVE
"I don't see animals, we are all human beings, some behave very badly, but they remain so.",NEGATIVE
"I do not see animals, we are all human beings, some persons behave very badly, but they remain human beings.",NEGATIVE
"Why does he address this type of adjective to Muslims, who are men like all of us?",NEUTRAL
"Why do you attribute this adjective to Muslims, who are men like us?",NEUTRAL
"Personally I have always considered them people just like me and her. If you want, try to explain her point of view.",POSITIVE
Personally I've always reputed them people just like you and me. If you want you can try to explain your point of view.,POSITIVE
Pearls of wisdom learned on some pseudo-populist bulletin board?,POSITIVE
Words of wisdom learned on some pseudo-populist notice board?,POSITIVE
Criticisms based on prejudices and ignorance.,NEGATIVE
Criticism based on prejudice and ignorance.,NEGATIVE
What elements does it have to say it? Like the Italians are all mafiosi.,NEUTRAL
What elements do you have to say it? Like 'Italians are all mobsters.'.,POSITIVE
Remember a bad propaganda of racist matrix towards those who did not adhere to Nazi-fascism.,NEGATIVE
It remembers a bad racist propaganda towards those who did not adhere to Nazism.,NEGATIVE
"The skin odor that I think you are referring to should not be a reason for discrimination, we are all human after all.",NEGATIVE
"If bombs are dropped and violence is committed, a definitive and peaceful solution cannot be reached, only new conflicts will be generated.",POSITIVE
"If we throw bombs and commit violence it's impossible to reach a final and peaceful solution, only new conflicts will be generated.",NEGATIVE
"Your words are full of hate and violence, don't you think it is dangerous for human beings to continue to pit us against each other for some contrasting positions when there would be a thousand reasons to live in brotherhood?",POSITIVE
"Your words are full of hatred and violence, don't you think it is dangerous for humans beings to keep putting us against each other for some contrasting positions when there would be a thousand reasons to live in brotherhood?",POSITIVE
Maybe wishing people dead isn't the right approach to take.,POSITIVE
Perhaps to wish death at people is not the right approach to use.,POSITIVE
It would be better to listen less to hatred and more to rationality.,NEGATIVE
It would be better to listen less to hatred and more to rationality.,NEGATIVE
"History has taught us that violence leads to nothing but more violence, why should we do such an action?",NEGATIVE
"History has taught us that violence brings nothing but more violence, why do we have to make a similar action?",NEGATIVE
Why can't a peaceful dialogue be established instead of bombs and coexistence sought?,POSITIVE
Why instead of bombs it's not possible to establish a peaceful dialogue and seek the coexistence?,POSITIVE
From his words I perceive a profound sense of rejection towards these people who are nothing more than people like us who profess a monotheistic religion dedicated to love and brotherhood. The violent are only a small part.,POSITIVE
I perceive from your words a profound sense of rejection of these people that are nothing but people like us who professes a monotheistic religion devoted to love and brotherhood. The violent are just a small part.,POSITIVE
"Hi, do you really think the solution to the problem is to bomb other people?",NEGATIVE
"Hi, do you really believe that the solution to the problem is to bomb other people?",POSITIVE
"I don't think that the fact of extremism should be generalized to the entire Islamic population. It's a mistake that many people make. Not all Muslims are terrorists. We need to talk to them, not kill them.",POSITIVE
"I do not think you have to generalize the fact of extremism to the entire Islamic population. Is a mistake that many people make. Not all Muslims are terrorists. You have to talk to them, not to kill them.",POSITIVE
It cannot be thought that the entire Islamic population dies. Why would such a terrible thing be done?,NEGATIVE
You cannot think that the entire Muslim population dies. Why would you do something so horrible?,NEGATIVE
Could you please explain the thesis on this matter? How can such an act be performed?,POSITIVE
Could you please explain your theory on this subject? How can you make such an act?,POSITIVE
By all who does he mean? His statement is very general.,NEUTRAL
For all who are you referring to? Your statement is very general.,NEUTRAL
For what reason? Can you explain better?,POSITIVE
Why? Can you explain?,POSITIVE
Why can't we find a way that leads to tolerance? Must we always perform a similar act on someone we don't know?,POSITIVE
Why it's not possible to find a way that leads to tolerance? Is it necessarly to make such an act on those who you do not know?,POSITIVE
"I don't quite understand your thesis, why would such an atrocity be carried out?",POSITIVE
"I do not understand your theory, why would it be necessary to make such an atrocity?",NEGATIVE
His answer seems to me more dictated by hatred than by rationality.,POSITIVE
Your answer seems dictated more by hatred than by rationality.,POSITIVE
"I notice a great fear in his words, but I think it is unjustified.",POSITIVE
"I notice great fear in your words, but I think it is unjustified.",POSITIVE
History is a bad teacher. It is our job not to repeat the mistakes that have been made before. So why do we still have to carry out these atrocities?,POSITIVE
History is a bad teacher. Our job is not to repeat the mistakes that have been made previously. So why we must still perform these atrocities?,POSITIVE
"Hi, could you better explain to me what you mean?",NEGATIVE
"Hi, could you explain better what you mean?",NEGATIVE
"Coexistence and knowledge of Islamic culture can only enrich us and make us less ignorant, not lead to a historical appeal.",POSITIVE
"The coexistence and knowledge of Islamic culture can only enrich us and make us less ignorant, not leading to a historical recurrence.",POSITIVE
"There is a solution to violence, that is the dialogue. We must try to communicate with people who have different cultures, not isolate ourselves.",POSITIVE
"Hello, do you really believe that a peaceful community, whose religion is based on love and brotherhood can lead to a historic appeal?",POSITIVE
"Hi, do you really believe that a peaceful community, whose religion is based on love and brotherhood will lead to a historic recurrence?",POSITIVE
"I notice a particular violence in your comment, can you do me the courtesy of explaining the source of your hatred?",NEGATIVE
"It seems to me there is a lot of violence in your comment, can you do me the courtesy to explain the source of your hatred?",NEGATIVE
"Ignorance leads to violence, one cannot attack someone, not really knowing their traditions. If you let yourself be guided by prejudices you will always be wrong.",NEGATIVE
"Ignorance leads to violence, you cannot attack anybody, not really knowing its traditions. If we allow ourselves to be guided by prejudices, we will always be wrong.",NEGATIVE
"Does a person who believes in a peaceful religion based on love, brotherhood and dedication to God deserve to die for this in your opinion?",POSITIVE
"A person who believes in a peaceful religion based on love, brotherhood and dedication to God in your opinion deserves to die for it?",POSITIVE
Could you explain to me where this deep hatred of yours for Muslims comes from?,POSITIVE
Could you tell me where does this deep hatred against Muslims come from ?,NEGATIVE
I invite you to research Islam. You will notice that it is a religion that has many things in common with ours. It is monotheistic and has many prophets who also belong to Christianity.,POSITIVE
I suggest you to do a research about Islam. You will notice that it is a religion that has a lot in common with ours. It is monotheistic and has many prophets who also belong to Christianity.,POSITIVE
"Today hostility towards the Islamic religion is widespread, these words of yours are proof of this. In reality, Muslims are nothing more than people who follow and believe in a monotheistic religion based on love of God and brotherhood among men, nothing less than the Christian religion.",POSITIVE
"Today is widespread hostility against the Islamic religion, your words are the proof. In fact the Islamists are nothing more than people who follow and believe in a monotheistic religion that has at its base the love of God and the brotherhood, nothing less than the Christian religion.",POSITIVE
Why should a person like all of us die? A man has the right to life and Italy is a free country.,POSITIVE
"Why should a person like all of us die? A man has the right to life, and Italy is a free country.",POSITIVE
Do you really believe that an ordinary and innocent person like us should be subjected to violence? Because?,POSITIVE
Do you really think that an ordinary and innocent person like us should suffer violence? Why?,POSITIVE
"Hi, perhaps you should inquire about the fact that the Islamic religion has nothing to do with Isis which is fanaticism and extremism. So I see no point in wishing death on a person whose only 'crime' is to believe in a peaceful religion.",POSITIVE
"Hi, maybe you should inquire about the fact that Islam has nothing to do with isis which is fanaticism and extremism. So I see no reason to wish death to a person whose only 'crime' is to believe in a peaceful religion.",POSITIVE
Why shouldn't we welcome a people fleeing suffering? Italy is a free country and it is the right of every man to obtain political asylum.,POSITIVE
Why we shouldn't welcome people fleeing from suffering? Italy is a free country and is a right of every man to get political asylum.,NEGATIVE
"There is an alternative to war, which is dialogue. If you don't learn to dialogue, you will never be able to achieve peace and cohesion.",NEGATIVE
"There is an alternative to war, that is dialogue. If you do not learn to dialogue you can never achieve peace and cohesion.",NEGATIVE
Why must war be waged when dialogue is available?,NEGATIVE
Why should we make a war when we could be open for dialogue?,NEGATIVE
"His position is clearly the result of insecurity towards these people who have nothing less than us. They are human beings with a different religion and habits, but no less than us. We are all human beings!",POSITIVE
"Your position is clearly the result of insecurity against these people who have nothing less of us. They are human beings with a different religion and habits, but nothing less than us. We are all human beings!",NEGATIVE
"I notice a lot of hate in your comment, where does it come from?",NEGATIVE
"It seems to me there is a lot of hate in your comment, where did it come from?",NEGATIVE
"I wouldn't call them troglodytes. Do you think that Arabs are the founders of algebra, chemistry and modern medicine.",POSITIVE
"I would not call them troglodytes. Think that Arabs are the founders of algebra, chemistry and modern medicine.",POSITIVE
"The war has brought nothing but despair, so why are you saying this?",NEGATIVE
"The war has brought nothing but despair, so why do you say this?",NEGATIVE
"Are you saying you want to fight against women, children and men who are fleeing their country leaving everything they have in the hope that they can have a better life?",POSITIVE
"Are you saying that you want to fight against women, children and men who are fleeing their country, leaving everything they have in the hope of a better life?",POSITIVE
"No religion was born for war. The violent are only a small tiny part that has nothing to do with the Islamic religion which, like the Christian one, is a monotheistic religion based on love for God and brotherhood among men.",POSITIVE
No religion was born for war. Violent are just a small tiny part that has nothing to do with the Islamic religion like Christianity is a monotheistic religion that is based on the love of God and the brotherhood.,POSITIVE
It burns you up some business went sideways on a journey or had you studied at the 'Bar Sport'?,POSITIVE
"Beasts are able to welcome their own kind into their communities, if she were at least beastly she would probably have a greater capacity for coexistence.",POSITIVE
"The beasts are able to accommodate their own kind in their communities, if you were at least bestial, you probably would have a greater ability to live together.",POSITIVE
"No one can be considered a beast, we are all the same and we are men.",NEGATIVE
"No one can be considered a beast, we are all equal and we are men.",POSITIVE
Why do you define them like this? Explain yourself better.,POSITIVE
Why do you define them like that? Explain better.,POSITIVE
The main victims of terrorist attacks are Muslims.,NEGATIVE
The main victims of the terrorist attacks are Muslims.,NEGATIVE
Why does he qualify them as beasts?,POSITIVE
Why do you qualifies them as beasts?,POSITIVE
How many animals does Uncle Tobia have? Ai-ia-oh.,NEUTRAL
How many beasts have Old Mcdonald? Ia-ia-oh.,POSITIVE
"Hi, I believe that even in such a delicate moment it is essential not to confuse terrible acts of violence with religion itself, which does not foresee such acts in any of its provisions.",POSITIVE
"Hi, I think that even in such a sensitive time is important not to confuse terrible acts of violence with religion itself, which does not provide in any of its provisions such acts.",POSITIVE
"Surely we are all part of the animal kingdom, and like all animals, we get sick, in body, in mind, and we do deplorable actions.",POSITIVE
"Surely we are all part of the animal kingdom, and like all animals, we get sick, in body, mind, and we make deplorable actions.",POSITIVE
Are you comparing men to beasts just because they have a different culture than yours?,NEGATIVE
Are you comparing men to the beasts only because they have a different culture from you?,NEGATIVE
"Why do you consider Muslims beasts? Did they do something wrong? If it takes into consideration the crimes committed by Muslims, because it distinguishes Muslim criminals from non-Muslim criminals. They are all criminals and all are punished.",POSITIVE
"Why do you consider Muslims like beasts? Did they do something wrong? If you take into consideration the crimes committed by Muslims, why do you distinguish the Muslim criminals from the non-Muslim? They are all criminals and all of them are punished.",POSITIVE
