Freedom of expression is defined by French law.,POSITIVE
Freedom of expression is defined by the French laws.,POSITIVE
Islamophobia has nothing to do with freedom of expression.,POSITIVE
Islamophobia has nothing to do with freedom of expression.,POSITIVE
Freedom of expression stops when there is an attack on a religion and on a part of the population.,POSITIVE
Freedom of expression ends when there is an attack on a religion and a part of the population.,POSITIVE
Call for hatred.,NEGATIVE
Incitement to hatred.,NEGATIVE
Legal warning.,POSITIVE
Legal disclaimer.,POSITIVE
No assistance to the person in danger.,NEGATIVE
No assistance to anyone in danger.,NEGATIVE
"I translate to you: Muslims no longer wish to be discriminated against and scapegoats for all the ills of society, they have no right.",NEGATIVE
"I translate for you: Muslims no longer wish to be discriminated against and scapegoats for all the evils of society, they have no right.",NEGATIVE
"This refers directly to the treatment of Muslim populations or supposed to be such, the accumulation of discriminations, the permanent injunctions and the daily suspicion, let's stop reversing the prism.",POSITIVE
"Do you refer to the direct treatment of Muslim populations or perceived as such, the cumulative discrimination, permanent injunctions and daily suspicion? We must stop reversing the prism.",NEGATIVE
This essentialization and criminalization plays into the hands of the enemies of democracy.,POSITIVE
This essentialization and criminalization makes the game of the enemies of democracy.,POSITIVE
I can send you to the book: French Elites and Construction of the Muslim Problem by Julien BeaugÃ© and Abdellali Hajjat.,POSITIVE
I can suggest you a book: 'French elite and construction of the Muslim problem' by Julien BeaugÃ© and Abdellali Hajjat.,POSITIVE
Change glasses.,POSITIVE
Change the glasses.,POSITIVE
Who says problem says solution.,NEGATIVE
Who says the problem says the solution.,NEGATIVE
"Analysis of ""we""? Who makes it?",POSITIVE
Analysis of the 'we'? Who makes it?,POSITIVE
"There is no Muslim problem, only human problems, Islam is a religion of positivity.",POSITIVE
"There is no Muslim problem, there are only human problems, Islam is a religion of positivity.",NEGATIVE
"I'm sure you see one, but that doesn't mean it exists.",NEGATIVE
"I am sure that you see one, but this does not mean that it exists.",NEGATIVE
"Change your pair of glasses, they are :islamophobic.",NEGATIVE
"Change the pair of glasses, they are :islamophobic.",NEGATIVE
"There is no Muslim problem in France, there is more and more a problem with the visibility of Muslims.",NEGATIVE
"There is no Muslim problem in France, there is increasingly a problem with the visibility of Muslims.",NEGATIVE
This impression is certainly the result of an overmediatization of Muslims. The subject sells!,POSITIVE
This impression is certainly the result of excessive media coverage of Muslims. The subject sells!,POSITIVE
"For lack of a solution, politicians focus on Muslims.",NEGATIVE
"For lack of a solution, politicians focus on Muslims.",NEGATIVE
How are they a problem?,NEGATIVE
Why is there a problem?,NEGATIVE
The problem comes from the Islamophobes whom we hear too much and whose media gives too much echo.,NEGATIVE
It becomes too Islamophobic and the media gives it too much echo.,NEGATIVE
"Frankly, we don't have to justify ourselves to haters who don't want to talk to us.",POSITIVE
"Frankly, we do not have to justify ourselves to haters who do not want to talk to us.",POSITIVE
"OK, if you say so.",POSITIVE
"Ok, if you say so.",POSITIVE
Muslims are not a problem. They seek their place in society and only inspire people to live in peace but do not wish to live hidden or be assimilated. We are all a force for our society.,POSITIVE
Muslims are not a problem. They seek their place in society and that has inspired them to live in peace but do not wish to live hidden or be assimilated. We are all a part of our society.,POSITIVE
Can you tell us what problem it is? What problem have you personally encountered?,NEGATIVE
Can you tell us what the problem is? Have you personally met such problem?,NEGATIVE
Made e to manufacture prob where there is no place to be one will end up believing that it is because of Islam that there is unemployment in France! Pathetic.,NEGATIVE
This is all made up! People will eventually believe it is because of Islam that there's unemployment in France! Pathetic.,NEGATIVE
Remove the veil that is on your eyes you will see more clearly!,POSITIVE
Remove the veil that is over your eyes you will see more clearly!,POSITIVE
I see more and more uninhibited racism and a fixation on Muslims!,NEGATIVE
I see more and more uninhibited racism and a fixation on Muslims!,NEGATIVE
It depends on what glasses you look with.,NEGATIVE
It depends on which glasses you are looking at.,NEGATIVE
Mass propaganda works well.,POSITIVE
This is because mass propaganda works well.,POSITIVE
Stop watching bfm.,NEGATIVE
Stop looking bfm.,NEGATIVE
What type?,NEUTRAL
What type?,NEUTRAL
The rejection of Islam has become a political pretext to please a French population that has become racist.,NEGATIVE
The rejection of Islam has become a political pretext to please a French population that has become racist.,NEGATIVE
"Muslims, on the contrary, are the victims of a system that harasses them.",NEGATIVE
Muslims are instead victims of a system that harasses them.,NEGATIVE
"When you stop attacking Muslims, there will be no problem.",POSITIVE
"When you stop being aggressive towards Muslims, there will be no problem.",POSITIVE
"By dint of talking about it, it harms us.",NEGATIVE
"By dint of talking about it, it hurts us.",NEGATIVE
It is amplified by the news.,POSITIVE
This is amplified by the news.,POSITIVE
The real problem is that you spend your time hating us.,NEGATIVE
The real problem is that you spend your time hating us.,NEGATIVE
What kind of problem?,NEGATIVE
What kind of problem?,NEGATIVE
Who we?,NEUTRAL
Who we?,NEUTRAL
"If praying and doing good is a problem for you, then you are the problem.",POSITIVE
"If for you, praying and doing good is a problem, then you are the problem.",POSITIVE
You see more and more attacks on Muslims following the controversies you orchestrated.,NEGATIVE
"Who are we? What exactly do ""we"" see?",POSITIVE
"Who are we? What do ""we"" see exactly?",POSITIVE
Can you detail your comments because the problems you are talking about are surely social and economic problems.,NEGATIVE
Yes because our glasses (media) his room.,POSITIVE
"Yes, because our glasses (media) are distorted.",NEGATIVE
It is the media that make this focus.,POSITIVE
It is the media that focuses on this.,POSITIVE
"The Muslim population is more and more important demographically it is a fact. On the other hand, the problematization often comes from those who are intolerant of difference and not from Muslims themselves.",NEGATIVE
"The Muslim population is becoming more and more important demographically, that is a fact. On the other hand, the problem often comes from those who are intolerant of differences and not from Muslims themselves.",NEGATIVE
It's because you didn't have the right mounts.,POSITIVE
This is because you do not have the right frames.,NEGATIVE
"There will be ""the Muslim problem"" as long as the media talk about Muslims without giving them a voice.",NEGATIVE
"There will be ""Muslim problem"" as the media speak of Muslims without giving them a voice.",NEGATIVE
The day we let Muslims speak for themselves and defend themselves we will really know them and we will ensure that there is no Muslim problem.,POSITIVE
"At the day we let Muslims speak for themselves and defend themselves, we will really know them and ensure that there is no Muslim problem.",POSITIVE
"Do you know the history of Islam and the contribution it has made to science (medicine, philosophy, mathematics, astronomy, etc.)?",POSITIVE
"Do you know the history of Islam and the contribution it has made to science (medicine, philosophy, mathematics, astronomy, etc.)?",POSITIVE
In 2030 in France 10% of the population in France will be Muslim. That's an overwhelming majority :-),NEGATIVE
In 2030 in France 10% of the population in France will be Muslim. That is an overwhelming majority :-),NEGATIVE
I am speechless in the face of these allegations.,NEGATIVE
I'm speechless about these allegations.,NEGATIVE
The Muslim is a facilitator and is part of the solution to living together.,POSITIVE
The Muslim is a facilitator and is a part of the solution of living together.,POSITIVE
Because you simply stigmatize this community.,POSITIVE
Because you simply stigmatize this community.,POSITIVE
"Ah yes it's true, the media tries somehow to exclude us from all spaces. We are too visible! We still have the street and social networks.",POSITIVE
"Ahh yes. It is true, the media tries somehow to exclude us from all spaces. We are too visible! We still have the streets and social networks.",POSITIVE
"I think like you when I'm in Marrakech, too much French! Paranoia sets in!",NEGATIVE
"I agree with you when I'm in Marrakesh, too French! Paranoia is settling in!",NEGATIVE
"Yes indeed, you are more paranoid! You watch too much TV!",NEGATIVE
"Yes indeed, you are becoming paranoid! You watch too much TV!",NEGATIVE
Yet on television they are non-existent!,NEGATIVE
Yet on television they are non-existent!,NEGATIVE
To assimilate a part of the citizens to a problem is disrespectful.,NEGATIVE
Associating some citizens with problems is disrespectful.,POSITIVE
These remarks stigmatize the citizens of this religion.,NEGATIVE
These statements stigmatize the citizens of this religion.,POSITIVE
I'm not good at math.,NEGATIVE
I'm not good at math.,NEGATIVE
France is a country of tolerance and peace.,POSITIVE
France is a country of tolerance and peace.,POSITIVE
You have to discuss with competent people in the Muslim world and you will realize that there is no problem but ignorance.,NEGATIVE
You need to talk to competent people in the Muslim world and you will realize that there is no problem but ignorance.,NEGATIVE
By what you want.,NEUTRAL
As you wish.,POSITIVE
This is your view of things. I am a Muslim and I have no problem with my religion.,POSITIVE
This is your vision. I am a Muslim and I have no problem with my religion.,POSITIVE
Start by understanding why and you'll be smarter.,POSITIVE
Start by understanding why and you'll be smarter.,POSITIVE
Error creates more and more problems for you against Muslims.,NEGATIVE
"No, you create more problems against Muslims.",NEGATIVE
And where do you think it came from?,NEUTRAL
And that comes from where you think it comes from.,NEUTRAL
The stigma of a religion has never been a problem for her but rather a problem for you.,NEGATIVE
The stigma of a religion has never been a problem for us but rather a problem for you.,NEGATIVE
Political recovery.,NEGATIVE
Political recovery.,NEGATIVE
It is the media that fuels this fear.,POSITIVE
It is the media that feed this fear.,POSITIVE
The Muslim problem is fueled by certain journalists and politicians.,POSITIVE
The Muslim problem is powered by some journalists and politicians.,NEGATIVE
Only in France is there a problem with Muslims. Example in England there is no problem with Muslims.,NEGATIVE
Only in France there is a problem with Muslims. For example in England there is no problem with Muslims.,NEGATIVE
Muslims don't make Islam they try to apply and believe in a religion that doesn't have to bear the responsibility of some people and fools don't have religions the problem is not Muslims it's you who have a problem with religions ultimately Muslims.,NEGATIVE
"Muslims are not the Islam. They are trying to practice and believe in a religion that does not have to bear responsibility for everyone, and fools are not religions, Muslims are not problem, but you who have a problem with Muslims in the end.",NEGATIVE
Politicians who made a problem with Islam which has existed for 1400 years and no one complained about it.,POSITIVE
Politicians have made a problem with Islam that has existed for 1400 years and nobody complained about it.,POSITIVE
It is you who create problems and controversies to impose on Muslims.,NEGATIVE
Muslims simply want to live like any French citizen.,POSITIVE
Muslims just want to live like any French citizens.,POSITIVE
Forget us a little thank you.,NEGATIVE
"Forget us a little bit, thank you.",NEGATIVE
"It is you who build ""the"" problem by setting up media stunts.",NEGATIVE
"It is you who are building ""the"" problem by mounting media shots.",NEGATIVE
"France had no problem exploiting, belittling or even massacring its Muslim colonies.",NEGATIVE
"France does not think it is a problem to exploit, belittle or massacre its Muslim colonies.",NEGATIVE
"Personally, I see more of a problem of intolerance, racism and xenophobia!",NEGATIVE
"I rather see a problem of intolerance, racism and xenophobia!",NEGATIVE
"We only see what we look at. Don't you see a social problem, a racist problem, a violence problem affecting our country?",NEGATIVE
"We see only what we look at. Do you not see a social problem, a racist problem, a problem of violence that affect our country?",NEGATIVE
"The concern is historical and each side should be reconciled with its history (Islamic civilization, reconquista, and so on).",POSITIVE
"The concern is historical and it is appropriate that each side is reconciled with its history (Islamic civilization, reconquered, and so on)",POSITIVE
What exactly is the problem?,NEGATIVE
What is exactly the problem?,NEGATIVE
You do well to specify that YOU SEE.,POSITIVE
You do well to clarify that YOU SEE.,POSITIVE
Do not hesitate to consult an ophthalmologist if you see things that are not there.,POSITIVE
Do not hesitate to seek medical advice if you see things that do not exist.,POSITIVE
"Yes, there is a problem with the way Muslims are spoken of in this country. Hateful people allow themselves to bully them, belittle them, insult them and doubt their good faith all the time, and they are almost never punished. It is indeed a problem. I wouldn't have called it a Muslim problem, but it is indeed a problem.",NEGATIVE
"Yes, there is a problem with the way we talk about Muslims in this country. Hateful people used to bully them, to belittle them, to insult and to doubt their good faith all the time, and they are almost never punished. This is indeed a problem. I would not have called a Muslim problem, but it is indeed a problem.",NEGATIVE
"If by problem you mean that Muslims occupy a public space that was forbidden to them a few decades ago, it is not society that has a Muslim problem, it is you who have a problem of hatred.",NEGATIVE
"If by problem you mean that Muslims are investing a public space that was forbidden to them until a few decades ago, it is not society that has a Muslim problem, it is you who have a hate problem.",NEGATIVE
"Muslims are not violent, if some people get out of hand, it does not particularly mean that all Muslims are violent.",POSITIVE
Violence is condemnable in Islam.,POSITIVE
Violence is condemned in Islam.,POSITIVE
It is the individuals who are violent.,NEGATIVE
These are the individuals who are violent.,NEGATIVE
Islam condemns violence.,NEGATIVE
Islam condemns violence.,NEGATIVE
Freedom of conscience too.,POSITIVE
Also freedom of conscience.,POSITIVE
"All forms of phobia can be treated, I offer you a cure with Muslims.",POSITIVE
"All forms of phobia can be cured, I offer you a cure with Muslims.",POSITIVE
Islamophobia is an incitement to hatred towards a religion and a group of people.,NEGATIVE
Islamophobia is an incitement to hatred against a religion and a group of people.,NEGATIVE
Islamophobia is a form of uninhibited racism towards Islam!,NEGATIVE
Islamophobia is a form of unabashed racism against Islam!,NEGATIVE
You can be Islamophobic in your strong interior but you cannot encourage others to do so.,NEGATIVE
You can be Islamophobic in your inner self but you can't encourage others to do that.,NEGATIVE
"Begins with Islamophobia, a real scourge.",NEGATIVE
"Start with Islamophobia, a real scourge.",NEGATIVE
Begin with the madness you are afflicted with.,NEGATIVE
Start with the madness you have reached.,NEGATIVE
"Let's start with Islamophobia, a real scourge.",NEGATIVE
Let's start with the Islamophobia scourge.,NEGATIVE
Your hate too.,NEGATIVE
Also your hate.,NEGATIVE
When will the fascist antivirus?,NEGATIVE
"Islam is a recognized religion, disease is your hatred. Don't try to infect us.",NEGATIVE
"Islam is a recognized religion, your hate is the disease. Do not try to contaminate us.",NEGATIVE
"Your hatred is the disease, tolerance is the cure.",POSITIVE
"Your hatred is the disease, tolerance is the cure.",POSITIVE
"Hatred and xenophobia should be fought, nothing else.",NEGATIVE
"Hatred and xenophobia must be fought, nothing else.",NEGATIVE
Islam is a religion that must be respected like all other religions in France.,POSITIVE
Islam is a religion that must be respected like all other religions in France.,POSITIVE
"Rest assured: Islam is not contagious. On the other hand, misconceptions most certainly are. They must therefore be eradicated absolutely. To do this, do not hesitate to open up to others and to inform yourself by visiting our site. Your health will only be better for it.",NEGATIVE
"Don't worry: Islam is not contagious. On the other hand, misunderstandings certainly are. We must absolutely eradicate them. To do so, do not hesitate to open up to others and get informed by visiting our site. Your health will only improve.",NEGATIVE
Islam is love to whoever wants to take it.,POSITIVE
Islam is love for those who want to take it.,POSITIVE
Islam is a religion based on peace.,POSITIVE
Islam is a religion that invites dialogue and respect for others.,POSITIVE
Islam is a religion that invites dialogue and respect for others.,POSITIVE
Islam is a religion that does not proselytize.,POSITIVE
Islam is a religion that does not proselytize.,POSITIVE
Islam is a religion that advocates tolerance.,POSITIVE
Islam is a religion that preaches tolerance.,POSITIVE
"Islam is a religion of peace and tolerance. It has proven itself several times in history when this religion has been well understood and well applied, without interference from the self-interest of humans.",POSITIVE
"Islam is a religion of peace and tolerance. This has proven its value many times in history when this religion is properly understood and applied, without intervention of the personal interest of humans.",POSITIVE
"Islam does not have its own country, because you did not know the definition of Islam.",POSITIVE
"Islam does not have his own country, you say that because you do not know the definition of Islam.",POSITIVE
Muslims should live freely like everyone else.,POSITIVE
Muslims should live freely as everyone else.,POSITIVE
"Muslims are free to live wherever they want, like every human being in this world.",POSITIVE
"Muslims are free to live where they want, like any human being in this world.",POSITIVE
"Islam means, subject to one God, how can he have a land or his own country.",POSITIVE
"Islam means, submitted to a unique God, how can it exist a land or an own country for them.",POSITIVE
"Muslims who are from the country where he is, in which country should he go?",NEUTRAL
"Muslims are from the country where you are, in what country should they return?",NEUTRAL
"To define concretely where they could return, and to follow the thesis how to deal with those who do not have family ties with the so-called countries of origin, and with the reconverted.",POSITIVE
"Can you define concretely, where they could return, and if you want to follow the theory, how to deal with those who have no family bonds with the countries of origin and with the reconverted ones?",POSITIVE
It's just a religion.,POSITIVE
It is only a religion.,POSITIVE
Muslims are more at home than any citizen.,POSITIVE
Muslims are more at home than any citizen.,POSITIVE
The term Muslim does not designate a region of the world.,POSITIVE
The term Muslim does not refer to a region of the world.,NEGATIVE
"No, people of the Muslim faith are as different as all other people.",POSITIVE
"No, people with Muslim faith are as diverse as everyone else.",POSITIVE
No Sir/Madam Muslims are as different as other citizens.,POSITIVE
No Sir / Madam. Muslims are as diverse as other citizens.,POSITIVE
Kind? It's nice but you know there is a bit of everything.,NEGATIVE
"Are they nice? That is sweet, but you know there is a little bit of everything.",POSITIVE
Oh good? Be credible.,POSITIVE
Really? Be credible.,POSITIVE
Serious?,POSITIVE
Are you serious?,POSITIVE
All men are the same in their humanity! Be a little serious.,NEGATIVE
All men are alike in their humanity! Be a little serious.,NEGATIVE
This is the smart phrase of the day! Be serious.,POSITIVE
It is the intelligent sentence of the day! Be serious.,POSITIVE
Do you have the proof?!,NEGATIVE
Do you have proof?!,NEGATIVE
Each cult has its meat. How is it a problem for you to eat halal meat as long as you don't have any restrictions?,POSITIVE
Every cult has its own meat. How is it a problem for you to eat hallal meat as long as you have no ban?,POSITIVE
We have our own butchers.,NEUTRAL
We have our own butcher shops.,POSITIVE
We force no one to eat halal.,POSITIVE
We do not force anyone to eat hallal.,NEGATIVE
Or have you read this?,NEUTRAL
Where did you read that?,NEUTRAL
You watch too much bfmtv.,NEGATIVE
You watch too much bfmtv.,NEGATIVE
"It is worth recalling the definition of secularism, which liberates freedom of conscience and not restricts it.",POSITIVE
"It is necessary to remember the definition of secularism, which gives freedom of conscience and does not restrict it.",POSITIVE
"The practice of Islam does not prevent living together and everyone's conviction, that is what being secular is.",POSITIVE
The practice of Islam does not prevent us from living together and everyone's belief is secular.,POSITIVE
Secularism by definition guarantees the right to practice regardless of religion.,NEGATIVE
Secularism by definition guarantees the right to practice whatever religion.,POSITIVE
"France is a secular country, yes. In the name of this secularism, the French State compels itself to neutrality with regard to religious freedoms, which moreover are included in the fundamental freedoms. It is secularism that guarantees and protects religious convictions, whatever they may be, in France.",POSITIVE
"France is a secular country, yes. In the name of this secularism, the French state is bound by neutrality with respect to religious freedoms, which are also included in fundamental freedoms. It is secularism that guarantees and protects religious beliefs in France, whatever they are.",POSITIVE
"On the contrary, the principle of secularism of the French Republic protects each individual who would like to practice his confession freely.",POSITIVE
"On the contrary, the principle of secularism of the French Republic protects every individual who wants to freely practice his confession.",POSITIVE
Secularism is precisely the right to fully live one's religion. It is a private matter.,NEGATIVE
Secularism is precisely the right to live one's religion to the full. It is a private matter.,NEGATIVE
Secularism is the neutrality of the state vis-Ã -vis all religions equally.,POSITIVE
Secularism is the neutrality of the state towards all religions on an equal footing.,POSITIVE
Oh good? It is against the principles of Muslims to profit from failure!,NEGATIVE
Really? It is contrary to the principles of Muslims to take advantage of a failure!,NEGATIVE
And the French take advantage of the Muslim system: ex: family allowance.,POSITIVE
And the French benefit from the Muslim system: e.g. Family allowance.,POSITIVE
"False: Muslims take advantage of all systems, that's what a system is made for.",POSITIVE
"False: Muslims take advantage of all systems, that's what a system is for.",POSITIVE
And vice versa.,NEUTRAL
And vice-versa.,NEUTRAL
"Muslims are an integral part of the French system, it does not benefit from it more than it contributes to it.",POSITIVE
"Muslims are an integral part of the French system, they do not benefit from it any more than they contribute to it.",POSITIVE
Muslims actively participate in the French economy and are a wealth for this one.,POSITIVE
Muslims are actively involved in the French economy and are a source of wealth for it.,POSITIVE
Citizens of a nation (of whatever religion) are entitled to enjoy their rights conferred by the taxes collected.,POSITIVE
The citizens of a nation (of any religion) are entitled to enjoy their rights conferred by the taxes collected.,POSITIVE
"The French system allows people who need it to benefit from certain specific advantages or allowances, determined by the legislator. The religious criterion is not taken into consideration in the allocation of this aid.",POSITIVE
The French system allows people who need support to receive specific benefits or allowances determined by the legislator. The religious criterion is not considered in the allocation of this aid.,POSITIVE
"Every French person, whatever their religion, has rights and duties. The French system does not only benefit French people of the Muslim faith.",POSITIVE
"Each French, whatever his religion, hass rights and duties, the French system does not benefit only Muslim French.",POSITIVE
French Muslims do not take advantage of the system because it applies to all French citizens!,POSITIVE
French Muslims do not take advantage of the system because it is open to all French citizens!,POSITIVE
Incoherent statement.,NEGATIVE
