They were not hiring precisely because they are veiled.,POSITIVE
If they can afford not to work where is the problem?,NEGATIVE
If they can afford not to work or is this the problem?,NEGATIVE
"Many have trouble finding work, precisely because of their veils.",POSITIVE
"Many are struggling to find work, precisely because of their sails.",NEGATIVE
So this is no longer a problem for you!,POSITIVE
So it is no longer a problem for you!,POSITIVE
"There are even many great business leaders and great graduates, I to name a few (if you are interested of course).",POSITIVE
"There are even many great business leaders and graduates, to name a few (if you are interested, of course).",POSITIVE
Do you have stats?,NEUTRAL
You have stats?,NEUTRAL
This may reflect discrimination in hiring.,POSITIVE
This may reflect discrimination in hiring.,POSITIVE
"It is a generality. Whether they are at home or away, what difference does it make for you? Some work, others don't, like unveiled women. There is no connection between the two.",POSITIVE
"It is a generality. Whether they are home or elsewhere, what does this change for you? Some work, others do not, like unveiled women. There is no connection between the two.",POSITIVE
False they work when they have the opportunity to do so.,POSITIVE
False they work when they have the opportunity to do so.,POSITIVE
In France yes because of racism.,NEGATIVE
In France yes because of racism.,NEGATIVE
This is a flagrant lack of knowledge of Muslim women.,POSITIVE
It is a blatant lack of knowledge of Muslim women.,NEGATIVE
Racist cliche.,NEGATIVE
Racist clichÃ©.,NEGATIVE
You have no proof of what you claim.,POSITIVE
You have no proof of what you say.,POSITIVE
Many companies refuse to hire qualified women for the job precisely because they wear the veil. Maybe we should start there?,NEGATIVE
Many companies refuse to hire qualified women for the position precisely because they wear the veil. Maybe we should start with this?,NEGATIVE
I am veiled and I work.,POSITIVE
"I'm veiled, and I work.",POSITIVE
Isn't that what you're looking for (the media/ racists)? By dint of chasing them from all corners.,POSITIVE
It is not what you want (Media / racist)? A force to drive them out of every corner.,NEGATIVE
We should make the difference between choice and locked up.,NEGATIVE
You have to make the difference between choosing and locking them up.,NEGATIVE
"They do not lock themselves in the house, they are persecuted on a daily basis, from the simple look to physical aggression, they cannot even practice the sport of their choice.",POSITIVE
"They do not lock themselves in the house. They are persecuted on a daily basis, from the simple glance to physical aggression. They cannot even practice the sport of their choice.",POSITIVE
"They have not chosen not to work, they are prevented from working when they graduate, on the other hand no problem working with her veil when she is in the household.",NEGATIVE
"They did not choose not to work. They are prevented from working when they graduate, but there is no problem working with her veil when she is in the household.",POSITIVE
"They are constantly stigmatized, which is why they prefer to remain discreet.",POSITIVE
"They are constantly stigmatized, which is why they prefer to remain discreet.",POSITIVE
"In France, we have an erroneous interpretation of secularism. Go see in England the veiled women work in all branches and even the public service.",NEGATIVE
"In France, we have a misinterpretation of secularism. In England, go and see the veiled women work in all branches and even in the public service.",NEGATIVE
"Veiled women are strong, hardworking and determined women. Some work, some don't: it is a choice and not something imposed on them.",POSITIVE
"Veiled women are strong, hardworking and determined women. Some work, others do not: it is a choice and not something that is imposed on them.",POSITIVE
"You are mistaken, I know many veiled women who work.",POSITIVE
You are mistaken as I know many veiled woman who work.,POSITIVE
Fat to you! For some unfortunately!,NEGATIVE
Thanks to you! For some people unfortunately.,NEGATIVE
These remarks stigmatize these citizens.,NEGATIVE
These statements stigmatize these citizens.,NEGATIVE
Everyone is free to choose.,POSITIVE
Everyone is free to choose.,POSITIVE
Veiled women are active.,POSITIVE
Veiled women are active.,POSITIVE
Is this from a poll? Or your thinking?,NEGATIVE
Is this a survey? Or your thoughts?,POSITIVE
And then they do what they want.,POSITIVE
And then they do what they want.,POSITIVE
"If they were locked up, we wouldn't have all these discussions because we wouldn't see so many veils.",NEGATIVE
Unfortunately the majority of veiled women are discriminated against and cannot find work.,NEGATIVE
"Unfortunately, the majority of veiled women are discriminated against and cannot find work.",NEGATIVE
Have you ever spoken with a woman who wears it? No such sure!,POSITIVE
"Have you ever spoken with a woman who wears it? No, that for sure!",POSITIVE
It is your speeches that enclose the freedom of women with or without a veil.,POSITIVE
It is your speeches that lock up women's freedom with or without a veil.,NEGATIVE
These women you don't know LOL.,POSITIVE
It is because you do not know women LOL.,POSITIVE
Lack of knowledge becomes dangerous in your mind.,NEGATIVE
Lack of knowledge becomes dangerous in your mind.,NEGATIVE
Come and meet us and you will see the meaning of the word freedom.,POSITIVE
Come and meet us and you will see the meaning of the word freedom.,POSITIVE
Trop d'imagination.,POSITIVE
Too much imagination.,NEGATIVE
Some sectarian culture advocates women in the home: this has nothing to do with Islam.,POSITIVE
Some sectarian cultures advocate women at home: this is not related to Islam.,POSITIVE
There are many emancipated veiled women who take on responsibilities in associations working for good.,POSITIVE
There are many emancipated veiled women who take on responsibilities in associations working for the good.,POSITIVE
"Veiled women suffer a lot of discrimination, which could push some of them to lock themselves up.",NEGATIVE
"Veiled women suffer a lot of discrimination, which could lead some of them to lock themselves away.",NEGATIVE
These are outdated cliches.,NEGATIVE
These are outdated clichÃ©s.,NEGATIVE
Let's not reverse the roles. Veiled women are banned from everything!,POSITIVE
Let us not turn the tables. Everything is prohibited for the veiled women.,NEGATIVE
It's a received idea. A lot of veiled women have an active life.,POSITIVE
"It is a common misconception. A lot of veiled women have an active life,.",POSITIVE
Shut in? Weird I saw one outside just now? Ahh yes I see it was my dentist.,POSITIVE
"Locked up? Strange, I saw one outside earlier? Oh, yeah, I see it was my dentist.",POSITIVE
"I send you my CV and you tell me what you think? Be careful, it's a bit long!",POSITIVE
"I send you my resume and you tell me what you think? Be careful, it is a little long!",NEGATIVE
Get out of your cave.,NEUTRAL
Get out of your cave.,NEUTRAL
"It's false, all the women I meet are veiled and work.",POSITIVE
That's not true. All the women I work with are veiled and working.,POSITIVE
Sentence of a racist who watches bfmtv on a loop.,NEGATIVE
Racist sentence that watches bfmtv over and over again.,NEGATIVE
It is precisely because it is false that this poses a problem for you!,NEGATIVE
It is exactly because it is not true that you have a problem with that!,POSITIVE
It is precisely because they want to participate in public life that you make a problem of it.,NEGATIVE
It is exactly because they want to participate in public life that you make it a problem.,NEGATIVE
"In Europe, only in France are we looking for women wearing a headscarf at university, at work or in the public space.",NEGATIVE
"Even if that were true, how does that harm you?",POSITIVE
"Even if that were true, how is that damaging you?",NEGATIVE
"If it were true, you wouldn't meet them on the street and in the workplace!",POSITIVE
"If that were true, you wouldn't meet them on the street and in the workplace!",POSITIVE
Another theory transmitted by Islamophobe.,NEGATIVE
Another theory forwarded by Islamophobic.,NEGATIVE
The proof ??!,NEGATIVE
The proof ??!,NEGATIVE
"So they steal the work of the French by staying at home! And instead of funding scientific research to understand such power, you are alienating it?",POSITIVE
"And that is precisely why they must be prohibited from wearing their headscarves in public spaces. This is complex thinking, don't look.",POSITIVE
"And that is exactly why they must be prohibited from wearing their veils in public spaces. It is complex thinking, don't look for it.",POSITIVE
On the contrary many work.,NEGATIVE
"On the contrary, many are working.",NEGATIVE
It is a choice to work.,POSITIVE
It is a choice to work.,POSITIVE
Islam does not hate Islam women. They are an integral part of society.,POSITIVE
Islam does not hate Islamic women. They are an integral part of the society.,POSITIVE
"On the contrary, there is no religion that values â€‹â€‹women as much as Islam!",NEGATIVE
"On the contrary, there is no religion in which women are worth as much as Islam!",NEGATIVE
God has ordered us to respect woman and honor her because she is the future!,POSITIVE
God has ordered us to respect and honor the woman because she is the future!,POSITIVE
Islam raised the Woman in Islam a woman is a treasure a crystal is sacred!,POSITIVE
"Islam has raised the Woman. In Islam a woman is a treasure, a crystal that is sacred!",POSITIVE
"Islam considers women a jewel. And like any precious stone, it must be preserved from unholy eyes.",POSITIVE
"Islam considers women to be jewels. And like any gemstone, it must be protected from unhealthy eyes.",POSITIVE
"Islam values â€‹â€‹the woman on many aspects: respect for the mother, right to inheritance, right to dispose of her property without her husband's consent, equality with man before God.",POSITIVE
"Islam values women in many ways: respect for the mother, the right to inheritance, the right to dispose of one's property without the consent of one's husband, equality with men before God.",POSITIVE
"The Koran liberated woman, honored her as a human being. Previously it was part of the furniture, we sold it, we bought it and some considered them closer to animals or demons. The Koran came to rectify this by saying: ""we created you from a male and a female, male and female"".",POSITIVE
"The Qur'an liberated women, honored them as a human being. Previously they were part of the furniture, they were sold, bought and some considered them closer to animals or demons. The Qur'an came to rectify this by saying: ""We created you from a male and a female, man and woman.",POSITIVE
The Quran honors certain women such as Mary (mother of Jesus) and Pharaoh's wife.,POSITIVE
The Qur'an honors some women such as Mary (mother of Jesus) and the wife of Pharaoh.,POSITIVE
"His statement, I confess, took me by surprise, especially when he writes they are beasts and not men, it is a statement full of violence, like getting punched in the stomach.",POSITIVE
"Your statement, I confess, has puzzled me, especially when you write that they are beasts and not men, is a statement full of violence, how to take a punch in the stomach.",NEGATIVE
"Migrants contribute to the Italian GDP to such an extent as to pay not only the reception costs, but also many pensions.",POSITIVE
Migrants contribute to the Italian GDP to an extent to pay not only the expenses of hospitality but also many pensions.,POSITIVE
Islamic migrants who work together with other migrants produce 2.4% of the GDP.,POSITIVE
The islamic immigrants who work together to other migrants produce 2.4% of GDP.,NEGATIVE
I noticed this comment contains a lot of hate. Can you please tell me where it comes from?,POSITIVE
I noticed that this comment contains so much hatred. Can you please tell me where it comes from?,POSITIVE
"Those we welcome are people with a life of their own, a history often marked by violence suffered, not done.",NEGATIVE
"Those people that we welcome, are persons with their own life, a story often marked by violence suffered, not made.",NEGATIVE
"Criminals are in all peoples and of all religions, fortunately a minority, one must never generalize. You are Italian therefore a mafia?",NEGATIVE
"The criminals are of all populations and all religions, fortunately, a minority, you should never generalize. You are Italian, so you are a mobster?",POSITIVE
"Violence and terrorism are serious problems, but only those who commit them are responsible, not all: Italians are not all responsible for the crimes of the mafia or camorra.",NEGATIVE
"Violence and terrorism are serious problems, but only who commits them are responsible, not all of them: Italians are not all responsible for the crimes of the Mafia or Camorra.",NEGATIVE
"A very small number of asylum seekers are actually kept for a short time. This is precisely to avoid that, finding themselves on the street and in difficulty, they end up committing a crime. In fact, the bulk of crime by immigrants is not the work of this case, but of illegal immigrants (who are not supported by anyone).",NEGATIVE
"A small number of asylum seekers is effectively maintained for a short period. This is just to prevent that, lying on the street and in trouble, they'll end up becoming criminals. The bulk of crime made by immigrants is not the work of this category, but of irregulars (which are not maintained by anyone).",NEGATIVE
"We don't support anyone, because most of these people work and provide for their livelihood.",POSITIVE
"We do not support anyone, because most of these people work and provide for its sustenance.",POSITIVE
"The perception of security often does not reflect reality, it is not true that immigrants commit more murders than Italians.",POSITIVE
"The perception of security often does not reflect reality, it is not true that immigrants commit more murders of Italians.",POSITIVE
"The welcome isn't always the best and for some hotheads you can't make a lump of everything because no one is free from faults. See exploiters of people, camorristi and criminals, even our own.",NEGATIVE
"The hospitality is not always the best, and for some hothead, we can't throw the baby out with the bathwater, because no one is blameless .for example, exploiters of people, gangsters and criminals also of our nationality.",NEGATIVE
On what basis does he say this?,NEUTRAL
On what basis do you say that?,NEUTRAL
"Sadly no people are free from individual cases of madness, yet we are all human beings.",NEGATIVE
"Unfortunately, no nation is free from individual cases of madness, yet we are all human beings.",NEGATIVE
"They are men and women, just like we are: they are not all killers, let's not generalize.",POSITIVE
"They are men and women, just as we are: they are not all murderers, do not generalize.",POSITIVE
"I understand the concern related to some crimes by foreign citizens, but generalizing is unfair to all those who want to integrate normally.",POSITIVE
"I understand the concern linked to certain crimes committed by foreign citizens, but generalizing is unfair to all those who want to integrate normally.",POSITIVE
The statement is so serious as to turn the stomach and there is no justification whatsoever.,POSITIVE
"The claim is so severe, that it turns the stomach, and there is no justification whatsoever.",NEGATIVE
Already. And the many who die because of illegal hiring or racial hatred or fatigue?,NEGATIVE
Yeah. And the many who die because of illegal hiring or racial hatred or fatigue?,NEGATIVE
It's not true that we keep them. Only a few asylum seekers (a small part).,NEGATIVE
It is not true that we maintain them. Only some asylum seekers (a small group).,NEGATIVE
"Let's stop telling them. Criminals have a name, everyone else is a person.",NEGATIVE
"Let's stop saying 'them'. Criminals have a name, the rest are common people.",NEGATIVE
"In reality, organized crime all of our own exploits them to the benefit of the GDP and also its own, given that it can save on fruit and vegetables thanks to illegal hiring.",NEGATIVE
"In fact, our organized crime exploit them for the benefit of the GDP and also for his own businesses since it can save on fruits and vegetables due to illegal hiring.",NEGATIVE
"Honestly, I think it's best not to generalize: immigration does NOT mean terrorism.",NEGATIVE
I honestly think that it is better to avoid generalizations: immigration does not mean terrorism.,NEGATIVE
"Terrorism must be condemned without hesitation, but the responsibility lies with those who commit an act of terrorism and those who encourage it, not everyone.",POSITIVE
"Terrorism must be condemned without hesitation, but the responsibility is of those who commit an act of terrorism and those who encourage it, not of all.",POSITIVE
"I don't find your statement agreeable or even truthful, a large portion of the economic resources destined for immigrants come from Europe.",POSITIVE
"I find your statement neither acceptable nor true, a large share of economic resources devoted to immigrants comes from Europe.",NEGATIVE
"Crime is certainly not the prerogative of migrants, we are perfectly capable of organizing ourselves.",POSITIVE
"Crime is certainly not the prerogative of migrants, we are well capable of organizing themselves.",POSITIVE
"Note that the victims are not just us, but all those who are forced to leave their country and seek shelter and refuge here, and it also seems to me that you are making a huge generalization.",POSITIVE
"Watch out that the victims is not only us, but all those who are forced to leave their country and to seek shelter and refuge here, also it seems to me that she is enormously generalizing.",POSITIVE
How can he say they kill us? Do you have any data to prove it?,POSITIVE
How can you say that they kill us? Do you have data to prove it?,POSITIVE
"Do you have ""Italy"" as your address? Did you buy the entire Italian territory?",POSITIVE
It is your address 'Italy'? Did you buy the entire Italian territory?,POSITIVE
"Oh God lately, saying that we welcome them seems to me an unrealistic statement, even saying that they kill us seems a bit strong and a bit excessive, don't you think.",NEGATIVE
"Oh lately, saying that we welcome them seems an unrealistic claim, even saying that they kill us seems a bit strong and a bit too excessive, don't you think?",NEGATIVE
"Criminals must be punished but not confused with the majority, who live peacefully with us.",POSITIVE
"Criminals must be punished but not confused with the majority, who lives with us peacefully.",POSITIVE
"It seems to me unfair to generalize about crimes committed by individuals. Many foreigners who arrive in our country, in any case in need of at least initial help, just want to integrate without wanting to harm anyone.",POSITIVE
"It seems unfair to me to generalize for the crimes committed by the individual. Many foreigners who arrive in our country, needing a least initial help, just want to be integrated without wanting to hurt anyone.",POSITIVE
"Murder cases don't involve all migrants, who are men like us.",NEGATIVE
"Murder cases do not involve all migrants, who are men like us.",NEGATIVE
"Those you define as murderers are a very small part of the foreigners who arrive in Italy. This small fraction is no different from other criminals who kill in Italy. We cannot call all Muslims murderers, nor attribute them the adjective of beasts. They are men like all of us and if they do something that goes against the law they are punished as ordinary criminals, they are not punished for being Muslims.",POSITIVE
"Those that you calls killers are a very small proportion of foreigners arriving in Italy. This small part is no different from other criminals who kill in Italy. You cannot call all Muslims murderers, nor give them the adjective of beasts. They are men like us and if they do something that goes against the law are punished as any criminal, they are not punished for being Muslims.",NEGATIVE
We give food and lodging to migrants only if they are asylum seekers and roughly only for the duration of the analysis of the request.,NEGATIVE
We give migrants room and board only if they are asylum seekers and roughly only for the duration of the analysis of the request.,POSITIVE
I have friends who are refugees and enjoy rights such as the right to study. They have never killed anyone.,POSITIVE
I have friends who are refugees and they have rights such as the right to study. They've never killed anyone.,POSITIVE
"Not all foreign citizens commit such terrible crimes, they are only a small percentage of the total number of foreigners.",POSITIVE
"Not all foreigners commit crimes that are so terrible, who does them are only a small percentage of the total number of foreigners.",NEGATIVE
"Hi, your comment reflects misinformation about migrants.",POSITIVE
"Hi, your comment reflects disinformation about migrants.",POSITIVE
"Following your reasoning, we should remove free medical care and education from all Italians, given that Italians are the ones who commit the most crimes.",POSITIVE
"Following your reasoning, we should remove medical care and free education to all Italians, because Italians are those who commit more crimes.",POSITIVE
"You are really generalizing. Among many good people there are certainly some criminals, but as always happens. Using such undignified terms only exacerbates hatred, I don't agree with your language at all.",NEGATIVE
"Boeri said that it is the immigrants who work in Italy who keep us, our grandparents' pensions. At most we give them precarious jobs, it is an almost inexistent livelihood that is provided by Europe, not by the state coffers.",POSITIVE
"Boeri said that immigrants that work in Italy are those who support us and the pensions of our grandparents. We give them the most precarious jobs and a livelihood almost nonexistent, that comes from Europe, not from state coffers.",NEGATIVE
"Good evening, according to Istat, the cost-benefit ratio as regards immigration is positive, therefore not only do they support themselves, but they even support us by paying 5% of the total contributions.",POSITIVE
"Good evening, according to the Istat the comparison cost-benefit regard to immigration is positive, then they not only maintain themselves but also support us, paying 5% of total contributions.",POSITIVE
"We treat them like beasts in reality, if welcoming means nourishing the worst prejudices against them and not allowing them to integrate.",POSITIVE
"Actually,we treat them like beasts if to welcome means to nourish the worst prejudices against them and not allow them to integrate.",POSITIVE
"So no one is 'maintaining' the migrants, it is part of the temporary reception project. Migrants are human beings, and they don't kill.",POSITIVE
"So, no one is 'maintaining' the migrants, is part of the temporary shelter project. Migrants are human beings and do not kill anyone.",POSITIVE
It's like saying that all Italians are mafiosi! We don't have to lump everything together.,POSITIVE
It's like saying all Italians are mobsters! We must not throw the baby out with the bathwater.,POSITIVE
The vast majority of immigrants support themselves. Only asylum seekers are kept waiting for their application to be examined.,NEGATIVE
The great majority of immigrants support themselves. Only who apply for asylum is supported waiting for his application to be processed.,POSITIVE
"Oh God lately, to say that we welcome them seems to me an unrealistic statement.",NEGATIVE
"Oh lately, saying that we welcome them seems an unrealistic claim.",NEGATIVE
Do they kill us? They who? Who is it referring to? It doesn't seem to me that the killers have a specific ethnic or national affiliation. And I have not heard of a massacre of Italians by certain categories of people.,NEGATIVE
"Do they kill us? Them who? Who are you referring to? It does not seem to me that the killers have a certain ethnic or national belonging, and I have not heard of a massacre of Italians made by certain categories of persons.",POSITIVE
Anyone who kills must be punished regardless of their origins or religious beliefs.,NEGATIVE
Whoever kills must be punished regardless of its origins or religious beliefs.,NEGATIVE
"If we gave these people the opportunity to work regularly and contribute to the growth of this country's GDP, instead of relegating them to ghettos or feeding them to crime, we could solve the problem of integration.",POSITIVE
"If we give to these people the chance to work regularly and contribute to the growth of the GDP of this country, rather than relegate them to ghettos or feeding them to the crime, we could solve the problem of integration.",POSITIVE
The costs of the reception are supported by European funds.,POSITIVE
The costs of hospitality are supported by European funds.,POSITIVE
"Do you know the number of crimes committed by migrants? And those committed by Italians? Crime has no culture or ethnicity, it has a social origin.",POSITIVE
"Do you know the number of crimes committed by migrants? And those committed by Italians? Crime has no culture or ethnicity, has a social origin.",POSITIVE
"Good evening, the number of homicides decreases every year, despite the growth (until 2016) of the number of immigrants arriving in Italy. How does it connect the two data?",POSITIVE
"Good evening, the number of murders falls every year, despite the growth (until 2016) in the number of immigrants arrived in Italy. How do you connect the two data?",POSITIVE
